ID,upset,scare,overp,leave,leada,awake
1,All the time,All the time,All the time,"Very, very worried/ concerned","Very, very worried/ concerned",All the time
2,Most of the time,Most of the time,Most of the time,Very worried/ concerned,Very worried/ concerned,Most of the time
3,Quite often,Quite often,Quite often,Fairly worried/ concerned,Fairly worried/ concerned,Quite often
4,Some of the time,Some of the time,Some of the time,Somewhat worried/ concerned,Somewhat worried/ concerned,Some of the time
5,Once in a while,Once in a while,Once in a while,A little worried/ concerned,A little worried/ concerned,Once in a while
6,Hardly any of the time,Hardly any of the time,Hardly any of the time,Hardly worried/ concerned,Hardly worried/ concerned,Hardly any of the time
7,None of the time,None of the time,None of the time,Not worried/ concerned,Not worried/ concerned,None of the time
